{
  "$schema": "https://json-schema.org/draft/2020-12/schema",
  "$id": "https://giftcompass.app/schemas/persona.schema.json",
  "title": "GiftCompass Persona (Recipient Interest Profile)",
  "description": "Structured, evidence-based interest profile of the gift RECEIVER. Produced by the Persona Builder from consented signals (quiz answers, manual input, or a receiver-donated export). This is interpretation, kept separate from the raw signals it was built from, and separate from the Gift Context (relationship / occasion / budget) which belongs to the SENDER's request.",
  "type": "object",
  "required": ["persona_id", "schema_version", "created_at", "consent", "interests", "provenance"],
  "additionalProperties": false,
  "properties": {
    "persona_id": { "type": "string", "description": "Opaque id. Never an account handle, phone number or email." },
    "schema_version": { "type": "string", "const": "1.0.0" },
    "created_at": { "type": "string", "format": "date-time" },
    "expires_at": { "type": "string", "format": "date-time", "description": "Retention limit. After this the persona is deleted (PDPL storage limitation)." },
    "locale": { "type": "string", "enum": ["ar-SA", "en-SA", "en"], "default": "ar-SA" },

    "consent": {
      "type": "object",
      "description": "PDPL Article 11 record. A persona without consent_given = true MUST NOT be used.",
      "required": ["consent_given", "granted_by", "purpose", "consent_version", "granted_at", "sources"],
      "additionalProperties": false,
      "properties": {
        "consent_given": { "type": "boolean" },
        "granted_by": { "type": "string", "enum": ["receiver", "sender_about_self"], "description": "Signal-based personas require 'receiver'. A sender-quiz persona describes the receiver but is given by the sender, so it is limited to the 'quiz' / 'manual' sources." },
        "purpose": { "type": "string", "const": "gift_recommendation" },
        "consent_version": { "type": "string" },
        "granted_at": { "type": "string", "format": "date-time" },
        "receiver_reviewed": { "type": "boolean", "default": false, "description": "True once the receiver saw the Preview & Approve screen and confirmed the inferred interests." },
        "sources": {
          "type": "array",
          "minItems": 1,
          "items": { "type": "string", "enum": ["quiz", "manual_caption", "tiktok_export", "pinterest", "spotify"] }
        },
        "raw_data_deleted": { "type": "boolean", "default": false, "description": "True once the uploaded export and raw items were deleted. Must be true before the persona is reused." },
        "revocable_until": { "type": "string", "format": "date-time" }
      }
    },

    "recipient_basics": {
      "type": "object",
      "description": "Coarse, non-identifying context only. No name, no handle, no exact birth date.",
      "additionalProperties": false,
      "properties": {
        "age_range": { "type": "string", "enum": ["under_12", "12_17", "18_24", "25_34", "35_44", "45_54", "55_plus", "unknown"] },
        "city": { "type": "string", "default": "Jeddah" },
        "life_stage": { "type": "string", "enum": ["student", "graduate", "working", "unknown"], "description": "Optional and self-declared. Never inferred from social signals." }
      }
    },

    "interests": {
      "type": "array",
      "description": "Only positive interests. A negatively-sentimented topic goes to `dislikes`, never here.",
      "items": {
        "type": "object",
        "required": ["key", "weight", "strength", "sentiment", "giftability", "evidence"],
        "additionalProperties": false,
        "properties": {
          "key": { "type": "string", "pattern": "^[a-z0-9_]+$", "description": "Must exist in interest-taxonomy.json. Joins to Product.interest_keys." },
          "label_en": { "type": "string" },
          "label_ar": { "type": "string" },
          "weight": { "type": "number", "minimum": 0, "maximum": 1, "description": "weight = raw / (raw + 2), raw = SUM over evidence of (signal_strength * recency_decay). Saturating, so one loud signal cannot reach 1.0." },
          "strength": { "type": "string", "enum": ["strong", "medium", "weak"], "description": "strong >= 0.66, medium 0.33-0.66, weak < 0.33. Presentation band for the weight." },
          "sentiment": { "type": "string", "enum": ["positive", "neutral"], "description": "Negative sentiment disqualifies an interest (P2: 'I hate Twilight' mentions Twilight but is a NO)." },
          "giftability": { "type": "number", "minimum": 0, "maximum": 1, "description": "How well this interest converts into a buyable gift. Defaults from the taxonomy, may be adjusted by the Persona Builder." },
          "confidence": { "type": "number", "minimum": 0, "maximum": 1 },
          "evidence": {
            "type": "array",
            "minItems": 1,
            "description": "At least one piece of evidence per interest. No evidence, no interest - this is what makes the persona auditable and lets the receiver remove what does not represent them.",
            "items": {
              "type": "object",
              "required": ["source", "signal_type"],
              "additionalProperties": false,
              "properties": {
                "source": { "type": "string", "enum": ["quiz", "manual_caption", "tiktok_export", "pinterest", "spotify"] },
                "signal_type": { "type": "string", "enum": ["posted", "reposted", "saved", "liked", "followed", "watched", "quiz_answer", "manual_caption"], "description": "Signal strength ladder (P2 / Task 2): posted 1.00 > reposted 0.90 > saved 0.80 > liked 0.60 > followed 0.55 > watched 0.30. quiz_answer 0.85, manual_caption 0.70." },
                "excerpt": { "type": "string", "maxLength": 140, "description": "Short human-readable trace shown on the Preview & Approve screen, e.g. a hashtag or quiz option. Never the full post, never a message." },
                "observed_at": { "type": "string", "format": "date" },
                "count": { "type": "integer", "minimum": 1, "default": 1 }
              }
            }
          },
          "removed_by_receiver": { "type": "boolean", "default": false, "description": "Kept as a tombstone so the same interest is not re-inferred on the next build." }
        }
      }
    },

    "dislikes": {
      "type": "array",
      "description": "Hard negatives. Used as an exclusion filter before ranking, never as a weak penalty.",
      "items": {
        "type": "object",
        "required": ["key", "source"],
        "additionalProperties": false,
        "properties": {
          "key": { "type": "string", "pattern": "^[a-z0-9_]+$" },
          "label_en": { "type": "string" },
          "reason": { "type": "string", "enum": ["negative_sentiment", "stated_dislike", "allergy_or_restriction_declared", "receiver_removed"] },
          "source": { "type": "string", "enum": ["quiz", "manual_caption", "tiktok_export", "pinterest", "spotify", "receiver_edit"] }
        }
      }
    },

    "style": {
      "type": "object",
      "additionalProperties": false,
      "properties": {
        "aesthetics": { "type": "array", "items": { "type": "string" }, "description": "From taxonomy style_tags, e.g. minimal, cozy, sporty." },
        "practical_vs_sentimental": { "type": "number", "minimum": -1, "maximum": 1, "description": "-1 fully practical, +1 fully sentimental, 0 unknown/balanced." },
        "product_vs_experience": { "type": "number", "minimum": -1, "maximum": 1, "description": "-1 prefers physical products, +1 prefers experiences." }
      }
    },

    "already_owns": {
      "type": "array",
      "description": "Excluded at filter time so we do not recommend a duplicate.",
      "items": {
        "type": "object",
        "required": ["label"],
        "additionalProperties": false,
        "properties": {
          "label": { "type": "string" },
          "interest_key": { "type": "string", "pattern": "^[a-z0-9_]+$" }
        }
      }
    },

    "blocked_attributes": {
      "type": "array",
      "description": "Fixed deny-list, written into every persona as a self-check. The Persona Builder must refuse to emit any field describing these, even when the signals would allow it (P3: a few likes can expose very sensitive traits).",
      "items": { "type": "string" },
      "default": ["religion", "health", "politics", "sexuality", "ethnicity", "income", "financial_status"]
    },

    "provenance": {
      "type": "object",
      "required": ["builder", "built_at", "signal_count"],
      "additionalProperties": false,
      "properties": {
        "builder": { "type": "string", "description": "e.g. persona-builder@1.0.0 (llm, json-mode)" },
        "built_at": { "type": "string", "format": "date-time" },
        "signal_count": { "type": "integer", "minimum": 0 },
        "source_mix": { "type": "object", "additionalProperties": { "type": "integer" } },
        "completeness": { "type": "number", "minimum": 0, "maximum": 1, "description": "How much of the profile is filled. Drives the 'we only have a little to go on' message instead of inventing interests." },
        "is_fallback": { "type": "boolean", "default": false, "description": "True when built from sender quiz only, because the receiver did not participate." }
      }
    }
  }
}
