{
  "persona_id": "psn_nouf",
  "schema_version": "1.0.0",
  "created_at": "2026-09-26T09:00:00Z",
  "expires_at": "2027-03-25T09:00:00.000Z",
  "locale": "ar-SA",
  "consent": {
    "consent_given": true,
    "granted_by": "receiver",
    "purpose": "gift_recommendation",
    "consent_version": "gc-consent-1.0-ar-en",
    "granted_at": "2026-09-20T10:00:00Z",
    "receiver_reviewed": true,
    "sources": [
      "quiz",
      "tiktok_export"
    ],
    "raw_data_deleted": true,
    "revocable_until": "2027-03-20T10:00:00Z"
  },
  "recipient_basics": {
    "age_range": "45_54",
    "city": "Jeddah",
    "life_stage": "working"
  },
  "interests": [
    {
      "key": "fragrance",
      "label_en": "Fragrance & oud",
      "label_ar": "العطور والعود",
      "weight": 0.79,
      "strength": "strong",
      "sentiment": "positive",
      "giftability": 0.85,
      "confidence": 0.76,
      "evidence": [
        {
          "source": "quiz",
          "signal_type": "quiz_answer",
          "excerpt": "Interests: skincare routine and oud",
          "observed_at": "2026-09-20",
          "count": 1
        },
        {
          "source": "tiktok_export",
          "signal_type": "reposted",
          "excerpt": "oud and bakhoor layering guide",
          "observed_at": "2026-08-11",
          "count": 5
        },
        {
          "source": "tiktok_export",
          "signal_type": "liked",
          "excerpt": "مراجعة عطر عود جديد",
          "observed_at": "2026-07-14",
          "count": 6
        }
      ]
    },
    {
      "key": "skincare",
      "label_en": "Skincare",
      "label_ar": "العناية بالبشرة",
      "weight": 0.77,
      "strength": "strong",
      "sentiment": "positive",
      "giftability": 0.75,
      "confidence": 0.64,
      "evidence": [
        {
          "source": "quiz",
          "signal_type": "quiz_answer",
          "excerpt": "Interests: skincare routine and oud",
          "observed_at": "2026-09-20",
          "count": 1
        },
        {
          "source": "tiktok_export",
          "signal_type": "saved",
          "excerpt": "evening skincare routine serum and spf",
          "observed_at": "2026-08-28",
          "count": 8
        }
      ]
    },
    {
      "key": "home_decor",
      "label_en": "Home & room decor",
      "label_ar": "ديكور المنزل",
      "weight": 0.68,
      "strength": "strong",
      "sentiment": "positive",
      "giftability": 0.8,
      "confidence": 0.64,
      "evidence": [
        {
          "source": "tiktok_export",
          "signal_type": "saved",
          "excerpt": "تنسيق ديكور غرفة المعيشة",
          "observed_at": "2026-07-06",
          "count": 5
        },
        {
          "source": "tiktok_export",
          "signal_type": "followed",
          "excerpt": "follows home decor accounts",
          "observed_at": "2026-06-02",
          "count": 4
        }
      ]
    }
  ],
  "dislikes": [
    {
      "key": "gaming",
      "label_en": "Gaming",
      "reason": "negative_sentiment",
      "source": "quiz"
    },
    {
      "key": "technology",
      "label_en": "Technology & gadgets",
      "reason": "negative_sentiment",
      "source": "quiz"
    }
  ],
  "style": {
    "aesthetics": [
      "classic",
      "cozy"
    ],
    "practical_vs_sentimental": 0.5,
    "product_vs_experience": -0.2
  },
  "already_owns": [
    {
      "label": "jade roller",
      "interest_key": "skincare"
    }
  ],
  "blocked_attributes": [
    "religion",
    "health",
    "politics",
    "sexuality",
    "ethnicity",
    "income",
    "financial_status"
  ],
  "provenance": {
    "builder": "persona-builder-deterministic@1.0.0",
    "built_at": "2026-09-26T09:00:00Z",
    "signal_count": 10,
    "source_mix": {
      "quiz": 4,
      "tiktok_export": 6
    },
    "completeness": 0.9,
    "is_fallback": false
  }
}
