{
  "persona_id": "psn_faisal",
  "schema_version": "1.0.0",
  "created_at": "2026-09-26T09:00:00Z",
  "expires_at": "2027-03-25T09:00:00.000Z",
  "locale": "ar-SA",
  "consent": {
    "consent_given": true,
    "granted_by": "receiver",
    "purpose": "gift_recommendation",
    "consent_version": "gc-consent-1.0-ar-en",
    "granted_at": "2026-09-20T10:00:00Z",
    "receiver_reviewed": true,
    "sources": [
      "quiz",
      "tiktok_export"
    ],
    "raw_data_deleted": true,
    "revocable_until": "2027-03-20T10:00:00Z"
  },
  "recipient_basics": {
    "age_range": "25_34",
    "city": "Jeddah",
    "life_stage": "graduate"
  },
  "interests": [
    {
      "key": "formula1",
      "label_en": "Formula 1 & racing",
      "label_ar": "الفورمولا 1",
      "weight": 0.77,
      "strength": "strong",
      "sentiment": "positive",
      "giftability": 0.9,
      "confidence": 0.76,
      "evidence": [
        {
          "source": "tiktok_export",
          "signal_type": "saved",
          "excerpt": "ferrari pit stop breakdown #formula1",
          "observed_at": "2026-08-05",
          "count": 6
        },
        {
          "source": "tiktok_export",
          "signal_type": "liked",
          "excerpt": "building the lego technic racing car",
          "observed_at": "2026-07-02",
          "count": 5
        },
        {
          "source": "tiktok_export",
          "signal_type": "followed",
          "excerpt": "follows racing collectibles shops",
          "observed_at": "2026-05-09",
          "count": 2
        }
      ]
    },
    {
      "key": "cars",
      "label_en": "Cars",
      "label_ar": "السيارات",
      "weight": 0.74,
      "strength": "strong",
      "sentiment": "positive",
      "giftability": 0.75,
      "confidence": 0.76,
      "evidence": [
        {
          "source": "quiz",
          "signal_type": "quiz_answer",
          "excerpt": "Interests: Formula 1 and cars",
          "observed_at": "2026-09-20",
          "count": 1
        },
        {
          "source": "tiktok_export",
          "signal_type": "liked",
          "excerpt": "building the lego technic racing car",
          "observed_at": "2026-07-02",
          "count": 5
        },
        {
          "source": "tiktok_export",
          "signal_type": "liked",
          "excerpt": "car detailing satisfying clips",
          "observed_at": "2026-06-18",
          "count": 7
        }
      ]
    },
    {
      "key": "gaming",
      "label_en": "Gaming",
      "label_ar": "الألعاب الإلكترونية",
      "weight": 0.63,
      "strength": "medium",
      "sentiment": "positive",
      "giftability": 0.9,
      "confidence": 0.64,
      "evidence": [
        {
          "source": "quiz",
          "signal_type": "quiz_answer",
          "excerpt": "Free time: gaming with friends",
          "observed_at": "2026-09-20",
          "count": 1
        },
        {
          "source": "tiktok_export",
          "signal_type": "saved",
          "excerpt": "new gaming setup rgb tour",
          "observed_at": "2026-07-25",
          "count": 4
        }
      ]
    },
    {
      "key": "collectibles",
      "label_en": "Collectibles & figures",
      "label_ar": "المقتنيات",
      "weight": 0.58,
      "strength": "medium",
      "sentiment": "positive",
      "giftability": 0.85,
      "confidence": 0.64,
      "evidence": [
        {
          "source": "tiktok_export",
          "signal_type": "liked",
          "excerpt": "building the lego technic racing car",
          "observed_at": "2026-07-02",
          "count": 5
        },
        {
          "source": "tiktok_export",
          "signal_type": "followed",
          "excerpt": "follows racing collectibles shops",
          "observed_at": "2026-05-09",
          "count": 2
        }
      ]
    }
  ],
  "dislikes": [
    {
      "key": "fragrance",
      "label_en": "Fragrance & oud",
      "reason": "negative_sentiment",
      "source": "quiz"
    }
  ],
  "style": {
    "aesthetics": [
      "sporty",
      "modern"
    ],
    "practical_vs_sentimental": -0.4,
    "product_vs_experience": 0.2
  },
  "already_owns": [],
  "blocked_attributes": [
    "religion",
    "health",
    "politics",
    "sexuality",
    "ethnicity",
    "income",
    "financial_status"
  ],
  "provenance": {
    "builder": "persona-builder-deterministic@1.0.0",
    "built_at": "2026-09-26T09:00:00Z",
    "signal_count": 10,
    "source_mix": {
      "quiz": 4,
      "tiktok_export": 6
    },
    "completeness": 0.8,
    "is_fallback": false
  }
}
