{
  "persona_id": "psn_omar",
  "schema_version": "1.0.0",
  "created_at": "2026-09-26T09:00:00Z",
  "expires_at": "2027-03-25T09:00:00.000Z",
  "locale": "ar-SA",
  "consent": {
    "consent_given": true,
    "granted_by": "receiver",
    "purpose": "gift_recommendation",
    "consent_version": "gc-consent-1.0-ar-en",
    "granted_at": "2026-09-20T10:00:00Z",
    "receiver_reviewed": true,
    "sources": [
      "quiz",
      "tiktok_export"
    ],
    "raw_data_deleted": true,
    "revocable_until": "2027-03-20T10:00:00Z"
  },
  "recipient_basics": {
    "age_range": "12_17",
    "city": "Jeddah",
    "life_stage": "student"
  },
  "interests": [
    {
      "key": "football",
      "label_en": "Football",
      "label_ar": "كرة القدم",
      "weight": 0.89,
      "strength": "strong",
      "sentiment": "positive",
      "giftability": 0.9,
      "confidence": 0.95,
      "evidence": [
        {
          "source": "quiz",
          "signal_type": "quiz_answer",
          "excerpt": "Interests: football, always watching matches",
          "observed_at": "2026-09-20",
          "count": 1
        },
        {
          "source": "quiz",
          "signal_type": "quiz_answer",
          "excerpt": "Free time: gym and football training",
          "observed_at": "2026-09-20",
          "count": 1
        },
        {
          "source": "tiktok_export",
          "signal_type": "reposted",
          "excerpt": "كورة اهلي الجولة الاخيرة",
          "observed_at": "2026-09-01",
          "count": 8
        },
        {
          "source": "tiktok_export",
          "signal_type": "liked",
          "excerpt": "football freestyle skills tutorial",
          "observed_at": "2026-08-19",
          "count": 12
        },
        {
          "source": "tiktok_export",
          "signal_type": "followed",
          "excerpt": "follows football club accounts",
          "observed_at": "2026-06-15",
          "count": 3
        }
      ]
    },
    {
      "key": "fitness",
      "label_en": "Fitness & gym",
      "label_ar": "اللياقة والرياضة",
      "weight": 0.67,
      "strength": "strong",
      "sentiment": "positive",
      "giftability": 0.85,
      "confidence": 0.64,
      "evidence": [
        {
          "source": "quiz",
          "signal_type": "quiz_answer",
          "excerpt": "Free time: gym and football training",
          "observed_at": "2026-09-20",
          "count": 1
        },
        {
          "source": "tiktok_export",
          "signal_type": "saved",
          "excerpt": "gym workout split for beginners",
          "observed_at": "2026-08-08",
          "count": 5
        }
      ]
    },
    {
      "key": "technology",
      "label_en": "Technology & gadgets",
      "label_ar": "التقنية",
      "weight": 0.49,
      "strength": "medium",
      "sentiment": "positive",
      "giftability": 0.85,
      "confidence": 0.52,
      "evidence": [
        {
          "source": "tiktok_export",
          "signal_type": "liked",
          "excerpt": "cheap tech gadgets under 100",
          "observed_at": "2026-07-28",
          "count": 4
        }
      ]
    }
  ],
  "dislikes": [
    {
      "key": "reading",
      "label_en": "Reading & books",
      "reason": "negative_sentiment",
      "source": "quiz"
    }
  ],
  "style": {
    "aesthetics": [
      "sporty",
      "colourful"
    ],
    "practical_vs_sentimental": -0.6,
    "product_vs_experience": 0.4
  },
  "already_owns": [],
  "blocked_attributes": [
    "religion",
    "health",
    "politics",
    "sexuality",
    "ethnicity",
    "income",
    "financial_status"
  ],
  "provenance": {
    "builder": "persona-builder-deterministic@1.0.0",
    "built_at": "2026-09-26T09:00:00Z",
    "signal_count": 9,
    "source_mix": {
      "quiz": 4,
      "tiktok_export": 5
    },
    "completeness": 0.7,
    "is_fallback": false
  }
}
