{
  "persona_id": "psn_faisal_baseline",
  "schema_version": "1.0.0",
  "created_at": "2026-09-26T09:00:00Z",
  "expires_at": "2027-03-25T09:00:00.000Z",
  "locale": "ar-SA",
  "consent": {
    "consent_given": true,
    "granted_by": "sender_about_self",
    "purpose": "gift_recommendation",
    "consent_version": "gc-consent-1.0-ar-en",
    "granted_at": "2026-09-20T10:00:00Z",
    "receiver_reviewed": false,
    "sources": [
      "quiz"
    ],
    "raw_data_deleted": true,
    "revocable_until": "2027-03-20T10:00:00Z"
  },
  "recipient_basics": {
    "age_range": "25_34",
    "city": "Jeddah",
    "life_stage": "graduate"
  },
  "interests": [
    {
      "key": "cars",
      "label_en": "Cars",
      "label_ar": "السيارات",
      "weight": 0.29,
      "strength": "weak",
      "sentiment": "positive",
      "giftability": 0.75,
      "confidence": 0.52,
      "evidence": [
        {
          "source": "quiz",
          "signal_type": "quiz_answer",
          "excerpt": "Interests: Formula 1 and cars",
          "observed_at": "2026-09-20",
          "count": 1
        }
      ]
    },
    {
      "key": "gaming",
      "label_en": "Gaming",
      "label_ar": "الألعاب الإلكترونية",
      "weight": 0.29,
      "strength": "weak",
      "sentiment": "positive",
      "giftability": 0.9,
      "confidence": 0.52,
      "evidence": [
        {
          "source": "quiz",
          "signal_type": "quiz_answer",
          "excerpt": "Free time: gaming with friends",
          "observed_at": "2026-09-20",
          "count": 1
        }
      ]
    }
  ],
  "dislikes": [
    {
      "key": "fragrance",
      "label_en": "Fragrance & oud",
      "reason": "negative_sentiment",
      "source": "quiz"
    }
  ],
  "style": {
    "aesthetics": [
      "sporty",
      "modern"
    ],
    "practical_vs_sentimental": -0.4,
    "product_vs_experience": 0.2
  },
  "already_owns": [],
  "blocked_attributes": [
    "religion",
    "health",
    "politics",
    "sexuality",
    "ethnicity",
    "income",
    "financial_status"
  ],
  "provenance": {
    "builder": "persona-builder-deterministic@1.0.0",
    "built_at": "2026-09-26T09:00:00Z",
    "signal_count": 4,
    "source_mix": {
      "quiz": 4
    },
    "completeness": 0.2,
    "is_fallback": true
  }
}
