{
  "persona_id": "psn_layla_baseline",
  "schema_version": "1.0.0",
  "created_at": "2026-09-26T09:00:00Z",
  "expires_at": "2027-03-25T09:00:00.000Z",
  "locale": "ar-SA",
  "consent": {
    "consent_given": true,
    "granted_by": "sender_about_self",
    "purpose": "gift_recommendation",
    "consent_version": "gc-consent-1.0-ar-en",
    "granted_at": "2026-09-20T10:00:00Z",
    "receiver_reviewed": false,
    "sources": [
      "quiz"
    ],
    "raw_data_deleted": true,
    "revocable_until": "2027-03-20T10:00:00Z"
  },
  "recipient_basics": {
    "age_range": "18_24",
    "city": "Jeddah",
    "life_stage": "student"
  },
  "interests": [
    {
      "key": "matcha",
      "label_en": "Matcha",
      "label_ar": "الماتشا",
      "weight": 0.29,
      "strength": "weak",
      "sentiment": "positive",
      "giftability": 0.9,
      "confidence": 0.52,
      "evidence": [
        {
          "source": "quiz",
          "signal_type": "quiz_answer",
          "excerpt": "Drinks: matcha every morning",
          "observed_at": "2026-09-20",
          "count": 1
        }
      ]
    },
    {
      "key": "reading",
      "label_en": "Reading & books",
      "label_ar": "القراءة والكتب",
      "weight": 0.29,
      "strength": "weak",
      "sentiment": "positive",
      "giftability": 0.9,
      "confidence": 0.52,
      "evidence": [
        {
          "source": "quiz",
          "signal_type": "quiz_answer",
          "excerpt": "Free time: reading and annotating books",
          "observed_at": "2026-09-20",
          "count": 1
        }
      ]
    },
    {
      "key": "home_decor",
      "label_en": "Home & room decor",
      "label_ar": "ديكور المنزل",
      "weight": 0.29,
      "strength": "weak",
      "sentiment": "positive",
      "giftability": 0.8,
      "confidence": 0.52,
      "evidence": [
        {
          "source": "quiz",
          "signal_type": "quiz_answer",
          "excerpt": "Style: minimal and cozy rooms",
          "observed_at": "2026-09-20",
          "count": 1
        }
      ]
    }
  ],
  "dislikes": [
    {
      "key": "makeup",
      "label_en": "Makeup",
      "reason": "negative_sentiment",
      "source": "quiz"
    }
  ],
  "style": {
    "aesthetics": [
      "minimal",
      "cozy"
    ],
    "practical_vs_sentimental": 0.2,
    "product_vs_experience": -0.3
  },
  "already_owns": [
    {
      "label": "electric milk frother",
      "interest_key": "matcha"
    }
  ],
  "blocked_attributes": [
    "religion",
    "health",
    "politics",
    "sexuality",
    "ethnicity",
    "income",
    "financial_status"
  ],
  "provenance": {
    "builder": "persona-builder-deterministic@1.0.0",
    "built_at": "2026-09-26T09:00:00Z",
    "signal_count": 4,
    "source_mix": {
      "quiz": 4
    },
    "completeness": 0.3,
    "is_fallback": true
  }
}
